{
  "$schema": "../fixture-metadata.schema.json",
  "schemaVersion": 1,
  "producer": "CharGenMenu",
  "producerVersion": "1.1.0.21 (private 1.16.244 rebuild)",
  "gameVersion": "1.16.244.0",
  "sourceNpc": {
    "plugin": "Starfield.esm",
    "localFormId": "00005983",
    "editorId": "Companion_SarahMorgan"
  },
  "loadedPlugins": [
    "Starfield.esm",
    "Constellation.esm",
    "BlueprintShips-Starfield.esm",
    "SFBGS007.esm",
    "SFBGS008.esm",
    "SFBGS006.esm",
    "SFBGS003.esm",
    "sfta01.esm",
    "sfta02.esm",
    "sfta03.esm",
    "sfta04.esm",
    "sfta05.esm",
    "sfta06.esm",
    "avontechmunitions.esm",
    "sfbgs00c.esm",
    "SP2_ImmersiveLandingRamps.esm",
    "disablegravjumpflash.esm",
    "CruiseTweaks.esm",
    "asc_deimos.esm",
    "kgcdoom.esm",
    "ShatteredSpace.esm",
    "blueprintships-sfta03.esm",
    "SFBGS050.esm",
    "SFBGS004.esm",
    "sfbgs019.esm",
    "blueprintships-sfta06.esm",
    "SFBGS00D.esm",
    "SFBGS047.esm",
    "BlueprintShips-SFBGS050.esm",
    "blep_gore_framework.esm"
  ],
  "files": {
    "Baseline.npc": {
      "controlledEdit": "Unchanged live Sarah appearance copied from reference 00005986 with player.capp, exported with the NPC action, and reloaded successfully.",
      "roundTripReloaded": true,
      "sha256": "EE8B47BF08CE017B9160C57311DEE581639B4ACED1F67C26F66D31771FFCB4CB"
    },
    "HeadpartOnly.npc": {
      "controlledEdit": "Changed only the Hair entry from Human_Female_Hair_Choppy_Bob to Human_Female_Hair_Faded_Afro through a Baseline-derived seed that CharGenMenu loaded, exported, and reloaded.",
      "roundTripReloaded": true,
      "sha256": "767AD0398898C921FDCE08FAFF941312276F4C421F23405850EE7F08BE9447DC"
    },
    "FacialMorphOnly.npc": {
      "controlledEdit": "Changed only female_eu_md2_Eyes from 0.210 to 0.310 through a Baseline-derived seed that CharGenMenu loaded, canonically exported, and reloaded.",
      "roundTripReloaded": true,
      "sha256": "C700A3485F7B4F104192628B5348342DCD0AD269D24C3412C7320A20AA52A2DA"
    },
    "TintOnly.npc": {
      "controlledEdit": "Changed only EyeColor from Green to Blue through a Baseline-derived seed that CharGenMenu loaded, exported byte-identically, and reloaded.",
      "roundTripReloaded": true,
      "sha256": "421325BF5ABAD7A85A360E3100C2BF2F497E58A978894F6C2A9152309CB9F477"
    },
    "BodyMorphOnly.npc": {
      "controlledEdit": "Changed only BodyMorphRegionValuesA[1] from 0.210 to 0.310 through a Baseline-derived seed that CharGenMenu loaded, canonically exported, and reloaded.",
      "roundTripReloaded": true,
      "sha256": "E1EA4ED3E755038ACEBDF98DF19BA62F8F5BA2088EBB16299FC407FF04F730AA"
    },
    "Sarah.npc": {
      "controlledEdit": "Composite vertical slice: BodyMorphRegionValuesA[1] 0.210 to 0.310, EyeColor Green to Blue, female_eu_md2_Eyes 0.210 to 0.310, and Hair Human_Female_Hair_Choppy_Bob to Human_Female_Hair_Faded_Afro; CharGenMenu loaded the seed, canonically exported it, and reloaded the result.",
      "roundTripReloaded": true,
      "sha256": "92EC1DC2649E5EC7F75AD2EBFC4FEDA2158B94DE90806DBC957B9A3809C3C33E"
    }
  }
}
