{
  "$schema": "../fixture-metadata.schema.json",
  "schemaVersion": 1,
  "producer": "Creation Kit",
  "producerVersion": "1.16.244.0",
  "gameVersion": "1.16.244.0",
  "sourceNpc": {
    "plugin": "Starfield.esm",
    "localFormId": "00005983",
    "editorId": "Companion_SarahMorgan"
  },
  "loadedPlugins": [
    "Starfield.esm"
  ],
  "files": {
    "Baseline.npc": {
      "controlledEdit": "Unchanged source appearance.",
      "roundTripReloaded": true,
      "sha256": "A96D8ABCBF4F3661B172084D8F82C73C5328F637256B12EDAB247B261D1A32FC"
    },
    "HeadpartOnly.npc": {
      "controlledEdit": "Changed only the Hair entry from Human_Female_Hair_Choppy_Bob to Human_Female_Hair_Faded_Afro.",
      "roundTripReloaded": true,
      "sha256": "7202DF0148C68BE10EBC74DD09910ED5FDE2BE5AE29C187EE82D15DA4A8677D9"
    },
    "FacialMorphOnly.npc": {
      "controlledEdit": "Changed only female_eu_md2_Eyes from 0.210 to 0.310; restored three CK-recalculated AVMS intensity ticks to their baseline values before export.",
      "roundTripReloaded": true,
      "sha256": "73A55CF445FB684CCD1EDD49A6257538C60FD32BCA7640B62B0458AF521D9027"
    },
    "TintOnly.npc": {
      "controlledEdit": "Changed only EyeColor from Green to Blue.",
      "roundTripReloaded": true,
      "sha256": "BF1FA053DEBC3B943851D555179EB942F9F75721CF39F01B60044C320BA9CEE0"
    },
    "BodyMorphOnly.npc": {
      "controlledEdit": "Changed only BodyMorphRegionValuesA[1] from 0.210 to 0.310 through a baseline-derived seed that the CK imported, canonically re-exported, and re-imported byte-identically.",
      "roundTripReloaded": true,
      "sha256": "B2050CF54EB914285AC8A01FD898C071B5BCADEBCAB0D85B06A46E5AD9B03091"
    },
    "Sarah.npc": {
      "controlledEdit": "Composite vertical slice: BodyMorphRegionValuesA[1] 0.210 to 0.310, EyeColor Green to Blue, female_eu_md2_Eyes 0.210 to 0.310, and Hair Human_Female_Hair_Choppy_Bob to Human_Female_Hair_Faded_Afro; restored CK-recalculated AVMS intensities to baseline.",
      "roundTripReloaded": true,
      "sha256": "0A80A57822FFF339CCADFA4B38264F1F78398AA14D4D3E8FB5FB5C11F4A35163"
    }
  }
}
